{
  "schemaVersion": "1.0.0",
  "provider": "chatgpt",
  "historyVersion": "1.0.0",
  "retentionPolicy": "unlimited",
  "items": [
    {
      "generatedAt": "2026-08-12T20:58:09Z",
      "status": "green",
      "action": "EA_ON",
      "tailRiskPct": 17,
      "tailLevel": "low",
      "stressRiskPct": 43,
      "stressLevel": "moderate",
      "confidencePct": 78,
      "confidenceLevel": "high",
      "dominantMode": "trend-up",
      "snapshot": "data/providers/chatgpt/snapshots/2026/08/2026-08-12T20-58-09Z.json"
    },
    {
      "generatedAt": "2026-08-12T22:03:27Z",
      "status": "green",
      "action": "EA_ON",
      "tailRiskPct": 19,
      "tailLevel": "low",
      "stressRiskPct": 48,
      "stressLevel": "elevated",
      "confidencePct": 74,
      "confidenceLevel": "solid",
      "dominantMode": "trend-up",
      "snapshot": "data/providers/chatgpt/snapshots/2026/08/2026-08-12T22-03-27Z.json"
    }
  ]
}